Sheet: tfg.csv
A1: universityName | B1: country | C1: countryCode | D1: continent | E1: universitySize | F1: universitySizeValue | G1: shangaiRanking | H1: courseraMOOCS | I1: edXMOOCS | J1: totalMOOCS | K1: M2 | L1: M9 | M1: M10
A2: Swiss Federal Institute of Technology Lausanne | B2: ='/Users/leirelitwin/Desktop/TFG/OTHERS/mooc-research-public/trunk/papers/emooc2017/[EMOOC-CONFERENCE.xlsx]COURSERA_EUROPE'!R[10]C[7] -> Switzerland | C2: CH | D2: Europe | E2: =5205+4919 -> 10124 | F2: =IF(RC[-1]<=5000,1,IF(RC[-1]<=15000,2,IF(RC[-1]<=25000,3,IF(RC[-1]<=35000,4,5)))) -> 2 | G2: 92 | H2: 8 | I2: 25 | J2: =SUM(#REF!) -> 33 | K2: =SUM(#REF!)/EXP(#REF!) -> 4.4660643468082188 | L2: =EXP(-#REF!) -> 1.1492457287923533E-2 | M2: =SUM(#REF!)/EXP(-#REF!/500) -> 39.666522162177948
A3: Delft University of Technology | B3: ='/Users/leirelitwin/Desktop/TFG/OTHERS/mooc-research-public/trunk/papers/emooc2017/[EMOOC-CONFERENCE.xlsx]EDX-EUROPE'!R[1]C -> Netherlands | C3: NL | D3: Europe | E3: 19613 | F3: =IF(RC[-1]<=5000,1,IF(RC[-1]<=15000,2,IF(RC[-1]<=25000,3,IF(RC[-1]<=35000,4,5)))) -> 3 | G3: 151 | I3: 51 | J3: =SUM(#REF!) -> 51 | K3: =SUM(#REF!)/EXP(#REF!) -> 2.539140486761061 | L3: =EXP(-#REF!) -> 7.893421564554004E-2 | M3: =SUM(#REF!)/EXP(-#REF!/500) -> 68.980622562183584
A4: Centrale Superior Paris | B4: ='/Users/leirelitwin/Desktop/TFG/OTHERS/mooc-research-public/trunk/papers/emooc2017/[EMOOC-CONFERENCE.xlsx]COURSERA_EUROPE'!R[27]C[7] -> France | C4: FR | D4: Europe | E4: 1394 | F4: =IF(RC[-1]<=5000,1,IF(RC[-1]<=15000,2,IF(RC[-1]<=25000,3,IF(RC[-1]<=35000,4,5)))) -> 1 | G4: 501 | H4: 3 | J4: =SUM(#REF!) -> 3 | K4: =SUM(#REF!)/EXP(#REF!) -> 1.103638323514327 | L4: =EXP(-#REF!) -> 0.33166219151100518 | M4: =SUM(#REF!)/EXP(-#REF!/500) -> 8.1711714969174256
A5: Chalmers University of Technology | B5: ='/Users/leirelitwin/Desktop/TFG/OTHERS/mooc-research-public/trunk/papers/emooc2017/[EMOOC-CONFERENCE.xlsx]EDX-EUROPE'!R[10]C -> Sweden | C5: SE | D5: Europe | E5: 11000 | F5: =IF(RC[-1]<=5000,1,IF(RC[-1]<=15000,2,IF(RC[-1]<=25000,3,IF(RC[-1]<=35000,4,5)))) -> 2 | G5: 201 | I5: 8 | J5: =SUM(#REF!) -> 8 | K5: =SUM(#REF!)/EXP(#REF!) -> 1.0826822658929016 | L5: =EXP(-#REF!) -> 0.33868586067616541 | M5: =SUM(#REF!)/EXP(-#REF!/500) -> 11.958490661408343
A6: Swiss Federal Institute of Technology Zurich | B6: ='/Users/leirelitwin/Desktop/TFG/OTHERS/mooc-research-public/trunk/papers/emooc2017/[EMOOC-CONFERENCE.xlsx]EDX-EUROPE'!RC -> Switzerland | C6: CH | D6: Europe | E6: 10851 | F6: =IF(RC[-1]<=5000,1,IF(RC[-1]<=15000,2,IF(RC[-1]<=25000,3,IF(RC[-1]<=35000,4,5)))) -> 2 | G6: 19 | I6: 8 | J6: =SUM(#REF!) -> 8 | K6: =SUM(#REF!)/EXP(#REF!) -> 1.0826822658929016 | L6: =EXP(-#REF!) -> 0.33868586067616541 | M6: =SUM(#REF!)/EXP(-#REF!/500) -> 8.3098498630279813
A7: Universidad Carlos III de Madrid | B7: ='/Users/leirelitwin/Desktop/TFG/OTHERS/mooc-research-public/trunk/papers/emooc2017/[EMOOC-CONFERENCE.xlsx]EDX-EUROPE'!R[13]C -> Spain | C7: ES | D7: Europe | E7: 18676 | F7: =IF(RC[-1]<=5000,1,IF(RC[-1]<=15000,2,IF(RC[-1]<=25000,3,IF(RC[-1]<=35000,4,5)))) -> 3 | G7: 501 | I7: 17 | J7: =SUM(#REF!) -> 17 | K7: =SUM(#REF!)/EXP(#REF!) -> 0.84638016225368706 | L7: =EXP(-#REF!) -> 0.42896490829169481 | M7: =SUM(#REF!)/EXP(-#REF!/500) -> 46.303305149198749
A8: University of Notre Dame | B8: ='/Users/leirelitwin/Desktop/TFG/OTHERS/mooc-research-public/trunk/papers/emooc2017/[EMOOC-CONFERENCE.xlsx]EDX-EUROPE'!R[5]C -> France | C8: FR | D8: Europe | E8: 12179 | F8: =IF(RC[-1]<=5000,1,IF(RC[-1]<=15000,2,IF(RC[-1]<=25000,3,IF(RC[-1]<=35000,4,5)))) -> 2 | G8: 501 | I8: 6 | J8: =SUM(#REF!) -> 6 | K8: =SUM(#REF!)/EXP(#REF!) -> 0.8120116994196761 | L8: =EXP(-#REF!) -> 0.44396404506171155 | M8: =SUM(#REF!)/EXP(-#REF!/500) -> 16.342342993834851
A9: Karolinska Institute | B9: ='/Users/leirelitwin/Desktop/TFG/OTHERS/mooc-research-public/trunk/papers/emooc2017/[EMOOC-CONFERENCE.xlsx]EDX-EUROPE'!R[-1]C -> Sweden | C9: SE | D9: Europe | E9: 5978 | F9: =IF(RC[-1]<=5000,1,IF(RC[-1]<=15000,2,IF(RC[-1]<=25000,3,IF(RC[-1]<=35000,4,5)))) -> 2 | G9: 44 | I9: 6 | J9: =SUM(#REF!) -> 6 | K9: =SUM(#REF!)/EXP(#REF!) -> 0.8120116994196761 | L9: =EXP(-#REF!) -> 0.44396404506171155 | M9: =SUM(#REF!)/EXP(-#REF!/500) -> 6.551928732169185
A10: Ecole Normale Superieure - Lyon | B10: ='/Users/leirelitwin/Desktop/TFG/OTHERS/mooc-research-public/trunk/papers/emooc2017/[EMOOC-CONFERENCE.xlsx]COURSERA_EUROPE'!R[15]C[7] -> France | C10: FR | D10: Europe | E10: 2000 | F10: =IF(RC[-1]<=5000,1,IF(RC[-1]<=15000,2,IF(RC[-1]<=25000,3,IF(RC[-1]<=35000,4,5)))) -> 1 | G10: 301 | H10: 2 | J10: =SUM(#REF!) -> 2 | K10: =SUM(#REF!)/EXP(#REF!) -> 0.73575888234288467 | L10: =EXP(-#REF!) -> 0.47914170878801532 | M10: =SUM(#REF!)/EXP(-#REF!/500) -> 3.6515333693191949
A11: Ecole Polytechnique | B11: ='/Users/leirelitwin/Desktop/TFG/OTHERS/mooc-research-public/trunk/papers/emooc2017/[EMOOC-CONFERENCE.xlsx]COURSERA_EUROPE'!R[43]C[7] -> France | C11: FR | D11: Europe | E11: 2888 | F11: =IF(RC[-1]<=5000,1,IF(RC[-1]<=15000,2,IF(RC[-1]<=25000,3,IF(RC[-1]<=35000,4,5)))) -> 1 | G11: 301 | H11: 2 | J11: =SUM(#REF!) -> 2 | K11: =SUM(#REF!)/EXP(#REF!) -> 0.73575888234288467 | L11: =EXP(-#REF!) -> 0.47914170878801532 | M11: =SUM(#REF!)/EXP(-#REF!/500) -> 3.6515333693191949
A12: Catholic University of Louvain | B12: ='/Users/leirelitwin/Desktop/TFG/OTHERS/mooc-research-public/trunk/papers/emooc2017/[EMOOC-CONFERENCE.xlsx]EDX-EUROPE'!R[-1]C -> Belgium | C12: BE | D12: Europe | E12: 29711 | F12: =IF(RC[-1]<=5000,1,IF(RC[-1]<=15000,2,IF(RC[-1]<=25000,3,IF(RC[-1]<=35000,4,5)))) -> 4 | G12: 151 | I12: 24 | J12: =SUM(#REF!) -> 24 | K12: =SUM(#REF!)/EXP(#REF!) -> 0.43957533332962034 | L12: =EXP(-#REF!) -> 0.64430997996724504 | M12: =SUM(#REF!)/EXP(-#REF!/500) -> 32.461469441027575
A13: University of Geneva | B13: ='/Users/leirelitwin/Desktop/TFG/OTHERS/mooc-research-public/trunk/papers/emooc2017/[EMOOC-CONFERENCE.xlsx]COURSERA_EUROPE'!R[7]C[7] -> Switzerland | C13: CH | D13: Europe | E13: 14489 | F13: =IF(RC[-1]<=5000,1,IF(RC[-1]<=15000,2,IF(RC[-1]<=25000,3,IF(RC[-1]<=35000,4,5)))) -> 2 | G13: 53 | H13: 3 | J13: =SUM(#REF!) -> 3 | K13: =SUM(#REF!)/EXP(#REF!) -> 0.40600584970983805 | L13: =EXP(-#REF!) -> 0.66630626971514506 | M13: =SUM(#REF!)/EXP(-#REF!/500) -> 3.3354656295195926
A14: IESE Business School | B14: ='/Users/leirelitwin/Desktop/TFG/OTHERS/mooc-research-public/trunk/papers/emooc2017/[EMOOC-CONFERENCE.xlsx]COURSERA_EUROPE'!R[59]C[7] -> Spain | C14: ES | D14: Europe | E14: =560+520+60+41+900 -> 2081 | F14: =IF(RC[-1]<=5000,1,IF(RC[-1]<=15000,2,IF(RC[-1]<=25000,3,IF(RC[-1]<=35000,4,5)))) -> 1 | G14: 501 | H14: 1 | J14: =SUM(#REF!) -> 1 | K14: =SUM(#REF!)/EXP(#REF!) -> 0.36787944117144233 | L14: =EXP(-#REF!) -> 0.69220062755534639 | M14: =SUM(#REF!)/EXP(-#REF!/500) -> 2.7237238323058088
A15: HEC Paris | B15: ='/Users/leirelitwin/Desktop/TFG/OTHERS/mooc-research-public/trunk/papers/emooc2017/[EMOOC-CONFERENCE.xlsx]COURSERA_EUROPE'!R[61]C[7] -> France | C15: FR | D15: Europe | E15: 4000 | F15: =IF(RC[-1]<=5000,1,IF(RC[-1]<=15000,2,IF(RC[-1]<=25000,3,IF(RC[-1]<=35000,4,5)))) -> 1 | G15: 501 | H15: 1 | J15: =SUM(#REF!) -> 1 | K15: =SUM(#REF!)/EXP(#REF!) -> 0.36787944117144233 | L15: =EXP(-#REF!) -> 0.69220062755534639 | M15: =SUM(#REF!)/EXP(-#REF!/500) -> 2.7237238323058088
A16: IsraelX | B16: ='/Users/leirelitwin/Desktop/TFG/OTHERS/mooc-research-public/trunk/papers/emooc2017/[EMOOC-CONFERENCE.xlsx]EDX-EUROPE'!R[1]C -> Israel | C16: ISR | D16: Europe | E16: 0 | F16: =IF(RC[-1]<=5000,1,IF(RC[-1]<=15000,2,IF(RC[-1]<=25000,3,IF(RC[-1]<=35000,4,5)))) -> 1 | G16: 501 | I16: 1 | J16: =SUM(#REF!) -> 1 | K16: =SUM(#REF!)/EXP(#REF!) -> 0.36787944117144233 | L16: =EXP(-#REF!) -> 0.69220062755534639 | M16: =SUM(#REF!)/EXP(-#REF!/500) -> 2.7237238323058088
A17: Institut Mines-Télécom | B17: ='/Users/leirelitwin/Desktop/TFG/OTHERS/mooc-research-public/trunk/papers/emooc2017/[EMOOC-CONFERENCE.xlsx]EDX-EUROPE'!R[-1]C -> France | C17: FR | D17: Europe | E17: 0 | F17: =IF(RC[-1]<=5000,1,IF(RC[-1]<=15000,2,IF(RC[-1]<=25000,3,IF(RC[-1]<=35000,4,5)))) -> 1 | G17: 501 | I17: 1 | J17: =SUM(#REF!) -> 1 | K17: =SUM(#REF!)/EXP(#REF!) -> 0.36787944117144233 | L17: =EXP(-#REF!) -> 0.69220062755534639 | M17: =SUM(#REF!)/EXP(-#REF!/500) -> 2.7237238323058088
A18: Technical University of Denmark | B18: ='/Users/leirelitwin/Desktop/TFG/OTHERS/mooc-research-public/trunk/papers/emooc2017/[EMOOC-CONFERENCE.xlsx]COURSERA_EUROPE'!R[21]C[7] -> Denmark | C18: DK | D18: Europe | E18: 11190 | F18: =IF(RC[-1]<=5000,1,IF(RC[-1]<=15000,2,IF(RC[-1]<=25000,3,IF(RC[-1]<=35000,4,5)))) -> 2 | G18: 151 | H18: 2 | J18: =SUM(#REF!) -> 2 | K18: =SUM(#REF!)/EXP(#REF!) -> 0.2706705664732254 | L18: =EXP(-#REF!) -> 0.7628677692336272 | M18: =SUM(#REF!)/EXP(-#REF!/500) -> 2.7051224534189644
A19: Leiden University | B19: ='/Users/leirelitwin/Desktop/TFG/OTHERS/mooc-research-public/trunk/papers/emooc2017/[EMOOC-CONFERENCE.xlsx]COURSERA_EUROPE'!R[-8]C[7] -> Netherlands | C19: NL | D19: Europe | E19: 24270 | F19: =IF(RC[-1]<=5000,1,IF(RC[-1]<=15000,2,IF(RC[-1]<=25000,3,IF(RC[-1]<=35000,4,5)))) -> 3 | G19: 93 | H19: 5 | J19: =SUM(#REF!) -> 5 | K19: =SUM(#REF!)/EXP(#REF!) -> 0.2489353418393197 | L19: =EXP(-#REF!) -> 0.77963038122150408 | M19: =SUM(#REF!)/EXP(-#REF!/500) -> 6.0221113018881489
A20: ITMO University | B20: ='/Users/leirelitwin/Desktop/TFG/OTHERS/mooc-research-public/trunk/papers/emooc2017/[EMOOC-CONFERENCE.xlsx]EDX-EUROPE'!R[-2]C -> Russia | C20: RU | D20: Europe | E20: 12000 | F20: =IF(RC[-1]<=5000,1,IF(RC[-1]<=15000,2,IF(RC[-1]<=25000,3,IF(RC[-1]<=35000,4,5)))) -> 2 | G20: 501 | I20: 1 | J20: =SUM(#REF!) -> 1 | K20: =SUM(#REF!)/EXP(#REF!) -> 0.1353352832366127 | L20: =EXP(-#REF!) -> 0.87342301849311665 | M20: =SUM(#REF!)/EXP(-#REF!/500) -> 2.7237238323058088
A21: Eindhoven University of Technology | B21: ='/Users/leirelitwin/Desktop/TFG/OTHERS/mooc-research-public/trunk/papers/emooc2017/[EMOOC-CONFERENCE.xlsx]COURSERA_EUROPE'!R[19]C[7] -> Netherlands | C21: NL | D21: Europe | E21: 9711 | F21: =IF(RC[-1]<=5000,1,IF(RC[-1]<=15000,2,IF(RC[-1]<=25000,3,IF(RC[-1]<=35000,4,5)))) -> 2 | G21: 201 | H21: 1 | J21: =SUM(#REF!) -> 1 | K21: =SUM(#REF!)/EXP(#REF!) -> 0.1353352832366127 | L21: =EXP(-#REF!) -> 0.87342301849311665 | M21: =SUM(#REF!)/EXP(-#REF!/500) -> 1.4948113326760428
A22: University of Lausanne | B22: ='/Users/leirelitwin/Desktop/TFG/OTHERS/mooc-research-public/trunk/papers/emooc2017/[EMOOC-CONFERENCE.xlsx]COURSERA_EUROPE'!R[47]C[7] -> Switzerland | C22: CH | D22: Europe | E22: 13500 | F22: =IF(RC[-1]<=5000,1,IF(RC[-1]<=15000,2,IF(RC[-1]<=25000,3,IF(RC[-1]<=35000,4,5)))) -> 2 | G22: 201 | H22: 1 | J22: =SUM(#REF!) -> 1 | K22: =SUM(#REF!)/EXP(#REF!) -> 0.1353352832366127 | L22: =EXP(-#REF!) -> 0.87342301849311665 | M22: =SUM(#REF!)/EXP(-#REF!/500) -> 1.4948113326760428
A23: The University of Edinburgh | B23: ='/Users/leirelitwin/Desktop/TFG/OTHERS/mooc-research-public/trunk/papers/emooc2017/[EMOOC-CONFERENCE.xlsx]COURSERA_EUROPE'!R[-19]C[7] -> UK | C23: UK | D23: Europe | E23: 35582 | F23: =IF(RC[-1]<=5000,1,IF(RC[-1]<=15000,2,IF(RC[-1]<=25000,3,IF(RC[-1]<=35000,4,5)))) -> 5 | G23: 41 | H23: 14 | I23: 3 | J23: =SUM(#REF!) -> 17 | K23: =SUM(#REF!)/EXP(#REF!) -> 0.11454509898445295 | L23: =EXP(-#REF!) -> 0.89177171951230227 | M23: =SUM(#REF!)/EXP(-#REF!/500) -> 18.452748767102332
A24: University of Zurich | B24: ='/Users/leirelitwin/Desktop/TFG/OTHERS/mooc-research-public/trunk/papers/emooc2017/[EMOOC-CONFERENCE.xlsx]COURSERA_EUROPE'!R[-9]C[7] -> Switzerland | C24: CH | D24: Europe | E24: 25732 | F24: =IF(RC[-1]<=5000,1,IF(RC[-1]<=15000,2,IF(RC[-1]<=25000,3,IF(RC[-1]<=35000,4,5)))) -> 4 | G24: 54 | H24: 6 | J24: =SUM(#REF!) -> 6 | K24: =SUM(#REF!)/EXP(#REF!) -> 0.10989383333240509 | L24: =EXP(-#REF!) -> 0.89592924807020424 | M24: =SUM(#REF!)/EXP(-#REF!/500) -> 6.6842864723188056
A25: The Hebrew University of Jerusalem | B25: ='/Users/leirelitwin/Desktop/TFG/OTHERS/mooc-research-public/trunk/papers/emooc2017/[EMOOC-CONFERENCE.xlsx]COURSERA_EUROPE'!R[-17]C[7] -> Israel | C25: ISR | D25: Europe | E25: 23000 | F25: =IF(RC[-1]<=5000,1,IF(RC[-1]<=15000,2,IF(RC[-1]<=25000,3,IF(RC[-1]<=35000,4,5)))) -> 3 | G25: 87 | H25: 2 | J25: =SUM(#REF!) -> 2 | K25: =SUM(#REF!)/EXP(#REF!) -> 9.9574136735727889E-2 | L25: =EXP(-#REF!) -> 0.90522283711452844 | M25: =SUM(#REF!)/EXP(-#REF!/500) -> 2.3801111316407253
A26: Autonomous University of Madrid | B26: ='/Users/leirelitwin/Desktop/TFG/OTHERS/mooc-research-public/trunk/papers/emooc2017/[EMOOC-CONFERENCE.xlsx]EDX-EUROPE'!R[-7]C -> Spain | C26: ES | D26: Europe | E26: =32206+3912 -> 36118 | F26: =IF(RC[-1]<=5000,1,IF(RC[-1]<=15000,2,IF(RC[-1]<=25000,3,IF(RC[-1]<=35000,4,5)))) -> 5 | G26: 201 | I26: 8 | J26: =SUM(#REF!) -> 8 | K26: =SUM(#REF!)/EXP(#REF!) -> 5.3903575992683736E-2 | L26: =EXP(-#REF!) -> 0.94752346610672611 | M26: =SUM(#REF!)/EXP(-#REF!/500) -> 11.958490661408343
A27: The University of Manchester | B27: ='/Users/leirelitwin/Desktop/TFG/OTHERS/mooc-research-public/trunk/papers/emooc2017/[EMOOC-CONFERENCE.xlsx]COURSERA_EUROPE'!R[-21]C[7] -> UK | C27: UK | D27: Europe | E27: 38590 | F27: =IF(RC[-1]<=5000,1,IF(RC[-1]<=15000,2,IF(RC[-1]<=25000,3,IF(RC[-1]<=35000,4,5)))) -> 5 | G27: 35 | H27: 8 | J27: =SUM(#REF!) -> 8 | K27: =SUM(#REF!)/EXP(#REF!) -> 5.3903575992683736E-2 | L27: =EXP(-#REF!) -> 0.94752346610672611 | M27: =SUM(#REF!)/EXP(-#REF!/500) -> 8.5800654500337306
A28: University College London | B28: ='/Users/leirelitwin/Desktop/TFG/OTHERS/mooc-research-public/trunk/papers/emooc2017/[EMOOC-CONFERENCE.xlsx]COURSERA_EUROPE'!R[-18]C[7] -> UK | C28: UK | D28: Europe | E28: 161270 | F28: =IF(RC[-1]<=5000,1,IF(RC[-1]<=15000,2,IF(RC[-1]<=25000,3,IF(RC[-1]<=35000,4,5)))) -> 5 | G28: 17 | H28: 8 | J28: =SUM(#REF!) -> 8 | K28: =SUM(#REF!)/EXP(#REF!) -> 5.3903575992683736E-2 | L28: =EXP(-#REF!) -> 0.94752346610672611 | M28: =SUM(#REF!)/EXP(-#REF!/500) -> 8.2766768538249433
A29: Copenhagen Business School | B29: ='/Users/leirelitwin/Desktop/TFG/OTHERS/mooc-research-public/trunk/papers/emooc2017/[EMOOC-CONFERENCE.xlsx]COURSERA_EUROPE'!R[-26]C[7] -> Denmark | C29: DK | D29: Europe | E29: 22829 | F29: =IF(RC[-1]<=5000,1,IF(RC[-1]<=15000,2,IF(RC[-1]<=25000,3,IF(RC[-1]<=35000,4,5)))) -> 3 | G29: 501 | H29: 1 | J29: =SUM(#REF!) -> 1 | K29: =SUM(#REF!)/EXP(#REF!) -> 4.9787068367863944E-2 | L29: =EXP(-#REF!) -> 0.95143199290045344 | M29: =SUM(#REF!)/EXP(-#REF!/500) -> 2.7237238323058088
A30: University of Oxford | B30: ='/Users/leirelitwin/Desktop/TFG/OTHERS/mooc-research-public/trunk/papers/emooc2017/[EMOOC-CONFERENCE.xlsx]EDX-EUROPE'!R[-16]C -> UK | C30: UK | D30: Europe | E30: 22602 | F30: =IF(RC[-1]<=5000,1,IF(RC[-1]<=15000,2,IF(RC[-1]<=25000,3,IF(RC[-1]<=35000,4,5)))) -> 3 | G30: 7 | I30: 1 | J30: =SUM(#REF!) -> 1 | K30: =SUM(#REF!)/EXP(#REF!) -> 4.9787068367863944E-2 | L30: =EXP(-#REF!) -> 0.95143199290045344 | M30: =SUM(#REF!)/EXP(-#REF!/500) -> 1.0140984589384923
A31: KU Leuven | B31: ='/Users/leirelitwin/Desktop/TFG/OTHERS/mooc-research-public/trunk/papers/emooc2017/[EMOOC-CONFERENCE.xlsx]EDX-EUROPE'!R[-22]C -> Belgium | C31: BE | D31: Europe | E31: 55484 | F31: =IF(RC[-1]<=5000,1,IF(RC[-1]<=15000,2,IF(RC[-1]<=25000,3,IF(RC[-1]<=35000,4,5)))) -> 5 | G31: 93 | I31: 7 | J31: =SUM(#REF!) -> 7 | K31: =SUM(#REF!)/EXP(#REF!) -> 4.7165628993598274E-2 | L31: =EXP(-#REF!) -> 0.95392938614090339 | M31: =SUM(#REF!)/EXP(-#REF!/500) -> 8.4309558226434085
A32: Ludwig-Maximilians-University of Munich (LMU) | B32: ='/Users/leirelitwin/Desktop/TFG/OTHERS/mooc-research-public/trunk/papers/emooc2017/[EMOOC-CONFERENCE.xlsx]COURSERA_EUROPE'!R[-6]C[7] -> Germany | C32: DE | D32: Europe | E32: 50542 | F32: =IF(RC[-1]<=5000,1,IF(RC[-1]<=15000,2,IF(RC[-1]<=25000,3,IF(RC[-1]<=35000,4,5)))) -> 5 | G32: 501 | H32: 5 | J32: =SUM(#REF!) -> 5 | K32: =SUM(#REF!)/EXP(#REF!) -> 3.3689734995427337E-2 | L32: =EXP(-#REF!) -> 0.96687144447782469 | M32: =SUM(#REF!)/EXP(-#REF!/500) -> 13.618619161529043
A33: Sorbonne University System | B33: ='/Users/leirelitwin/Desktop/TFG/OTHERS/mooc-research-public/trunk/papers/emooc2017/[EMOOC-CONFERENCE.xlsx]EDX-EUROPE'!R[-30]C -> France | C33: FR | D33: Europe | E33: 57800 | F33: =IF(RC[-1]<=5000,1,IF(RC[-1]<=15000,2,IF(RC[-1]<=25000,3,IF(RC[-1]<=35000,4,5)))) -> 5 | G33: 501 | I33: 5 | J33: =SUM(#REF!) -> 5 | K33: =SUM(#REF!)/EXP(#REF!) -> 3.3689734995427337E-2 | L33: =EXP(-#REF!) -> 0.96687144447782469 | M33: =SUM(#REF!)/EXP(-#REF!/500) -> 13.618619161529043
A34: Technical University Munich | B34: ='/Users/leirelitwin/Desktop/TFG/OTHERS/mooc-research-public/trunk/papers/emooc2017/[EMOOC-CONFERENCE.xlsx]COURSERA_EUROPE'!R[-25]C[7] -> Germany | C34: DE | D34: Europe | E34: 40000 | F34: =IF(RC[-1]<=5000,1,IF(RC[-1]<=15000,2,IF(RC[-1]<=25000,3,IF(RC[-1]<=35000,4,5)))) -> 5 | G34: 47 | H34: 2 | I34: 3 | J34: =SUM(#REF!) -> 5 | K34: =SUM(#REF!)/EXP(#REF!) -> 3.3689734995427337E-2 | L34: =EXP(-#REF!) -> 0.96687144447782469 | M34: =SUM(#REF!)/EXP(-#REF!/500) -> 5.4927987295858687
A35: RWTH Aachen University | B35: ='/Users/leirelitwin/Desktop/TFG/OTHERS/mooc-research-public/trunk/papers/emooc2017/[EMOOC-CONFERENCE.xlsx]EDX-EUROPE'!R[-33]C -> Germany | C35: DE | D35: Europe | E35: 42000 | F35: =IF(RC[-1]<=5000,1,IF(RC[-1]<=15000,2,IF(RC[-1]<=25000,3,IF(RC[-1]<=35000,4,5)))) -> 5 | G35: 201 | I35: 4 | J35: =SUM(#REF!) -> 4 | K35: =SUM(#REF!)/EXP(#REF!) -> 2.6951787996341868E-2 | L35: =EXP(-#REF!) -> 0.97340817035133109 | M35: =SUM(#REF!)/EXP(-#REF!/500) -> 5.9792453307041713
A36: Sapienza University of Rome | B36: ='/Users/leirelitwin/Desktop/TFG/OTHERS/mooc-research-public/trunk/papers/emooc2017/[EMOOC-CONFERENCE.xlsx]COURSERA_EUROPE'!R[-17]C[7] -> Italy | C36: IT | D36: Europe | E36: 112564 | F36: =IF(RC[-1]<=5000,1,IF(RC[-1]<=15000,2,IF(RC[-1]<=25000,3,IF(RC[-1]<=35000,4,5)))) -> 5 | G36: 151 | H36: 1 | J36: =SUM(#REF!) -> 1 | K36: =SUM(#REF!)/EXP(#REF!) -> 6.737946999085467E-3 | L36: =EXP(-#REF!) -> 0.99328470206784147 | M36: =SUM(#REF!)/EXP(-#REF!/500) -> 1.3525612267094822
A37: Lund University | B37: ='/Users/leirelitwin/Desktop/TFG/OTHERS/mooc-research-public/trunk/papers/emooc2017/[EMOOC-CONFERENCE.xlsx]COURSERA_EUROPE'!R[-35]C[7] -> Sweden | C37: SE | D37: Europe | E37: 41000 | F37: =IF(RC[-1]<=5000,1,IF(RC[-1]<=15000,2,IF(RC[-1]<=25000,3,IF(RC[-1]<=35000,4,5)))) -> 5 | G37: 101 | H37: 1 | J37: =SUM(#REF!) -> 1 | K37: =SUM(#REF!)/EXP(#REF!) -> 6.737946999085467E-3 | L37: =EXP(-#REF!) -> 0.99328470206784147 | M37: =SUM(#REF!)/EXP(-#REF!/500) -> 1.2238480081113581
A38: The Imperial College of Science, Technology and Medicine | B38: ='/Users/leirelitwin/Desktop/TFG/OTHERS/mooc-research-public/trunk/papers/emooc2017/[EMOOC-CONFERENCE.xlsx]EDX-EUROPE'!R[-31]C -> UK | C38: UK | D38: Europe | E38: 16610 | F38: =IF(RC[-1]<=5000,1,IF(RC[-1]<=15000,2,IF(RC[-1]<=25000,3,IF(RC[-1]<=35000,4,5)))) -> 3 | G38: 22 | I38: 0 | J38: =SUM(#REF!) -> 0 | K38: =SUM(#REF!)/EXP(#REF!) -> 0 | L38: =EXP(-#REF!) -> 1 | M38: =SUM(#REF!)/EXP(-#REF!/500) -> 0
A39: San Francisco State University | B39: United States | C39: USA | D39: America | E39: 17000 | F39: =IF(RC[-1]<=5000,1,IF(RC[-1]<=15000,2,IF(RC[-1]<=25000,3,IF(RC[-1]<=35000,4,5)))) -> 3 | G39: 1000 | H39: 3 | I39: 1 | J39: =SUM(#REF!) -> 4 | K39: =SUM(#REF!)/EXP(#REF!) -> 0.19914827347145578 | L39: =EXP(-#REF!) -> 0.81942838483367608 | M39: =SUM(#REF!)/EXP(-#REF!/500) -> 29.556224395722598